{
  "$schema": "http://json-schema.org/draft-07/schema#",
  "type": "array",
  "items": {
    "type": "object",
    "required": [
      "bot",
      "command",
      "description",
      "category",
      "cross_relevance",
      "notes"
    ],
    "properties": {
      "bot": {
        "type": "string"
      },
      "command": {
        "type": "string"
      },
      "description": {
        "type": "string"
      },
      "category": {
        "type": "string"
      },
      "cross_relevance": {
        "type": "string"
      },
      "notes": {
        "type": "string"
      }
    }
  }
}